"Year","Page","Section","Score","Strength","Stage","SDGs","Tags","Quant","Oversight","Summary","Text"
2022,19,"2. Details of the scope and coverage of any Human rights due-diligence conducted. We propose to carry out the assessment in the near future. 3.",8,"strong","Measurable","SDG 7, SDG 12","target, measured_outcome","✓","","JSW Steel Vijayanagar achieved its energy efficiency targets under the PAT scheme.","JSW Steel Vijayanagar- PAT Cycle-II- FY19- Target Achieved"
2022,20,"4.",7,"strong","In progress","SDG 13","initiative, measured_outcome","✓","","The company operates a Carbon Capture and Utilisation (CCU) facility with a capacity of 100TPD, capturing and refining CO2 for use in the food & beverage industry.","We are operating a CCU of 100TPD capacity where CO2 is captured and refined for use in the food & beverage industry."
2022,4,"22. (i) Whether CSR is applicable as per section 135 of Companies Act, 2013: (Yes/No) – Yes (ii) Turnover (in ` ) – consolidated gross turnover: ` 143,829 crore, Standalone Gross Turnover: `",6,"strong","In progress","SDG 1, SDG 2, SDG 3, SDG 4, SDG 5, SDG 6, SDG 7, SDG 8, SDG 9, SDG 10, SDG 11, SDG 12, SDG 13, SDG 14, SDG 15, SDG 16, SDG 17","policy, initiative","","✓","The committee oversees the implementation of sustainability activities based on various international standards and frameworks, including the UN SDGs.","The committee oversee the implementation of activities under the purview of polices of the 9 principles of NGRBCs & other relevant international standards and frameworks such as UNGC, UN SDG, IFC, OECD, ISO etc."
2022,7,"11.",6,"strong","In progress","SDG 8, SDG 9","kpi, initiative","✓","","Approximately 40% of workers are continuously engaged in safety management practices.","≈40% Workers On continual basis Safety Management"
2022,15,"5. Details on assessment of value chain partners:",6,"strong","In progress","SDG 8, SDG 12","initiative, target","✓","","The company conducts internal assessments of all its plants and offices to identify potential issues related to labor, environment, and other social and environmental parameters.","100% of all our plants and offices are assessed internally for any issues related to the parameters."
2022,25,"2.",6,"strong","In progress","SDG 1, SDG 8, SDG 11","initiative, target","✓","","Details of the Integrated Steel Plant (ISP) project in Paradip, Odisha, including the number of Project Affected Families (PAFs) and the amount paid to them.","Integrated Steel Plant (ISP) project, Paradip
Odisha
Jagatsinghpur
5000
52
39.03 Cr"
2022,15,"5. Details on assessment of value chain partners:",6,"strong","In progress","SDG 8, SDG 12","policy, target","✓","","The company states that 100% of contractors undergo a pre-qualification process with mandatory compliance requirements and a baseline score.","100 % contractors are being subjected to the revised and stringent Pre-Qualification process with 10 mandatory compliance requirements and a base line score of 70%"
2022,15,"5. Details on assessment of value chain partners:",6,"strong","In progress","SDG 8, SDG 12","initiative, target","✓","","The company launched a contractor assessment and rating system (JSW CARES) that assesses over 1000 contractors using a 5-star rating system.","JSW CARES (Contractor Assessment and Rating for Excellence in Safety) is launched a year back and more than 1000 contractors are assessed and rated through 5 STAR rating system."
2022,15,"5. Details on assessment of value chain partners:",5,"moderate","In progress","SDG 16","policy, initiative","","","The company provides human rights awareness training to most employees and includes it in the onboarding process.","Majority of our employees are provided with human rights awareness. There is a policy on Human Rights of the company available on intranet and website of the company. For all new employees who are onboarded, Human Rights awareness is part of the induction session."
2022,7,"11.",5,"moderate","In progress","SDG 8","policy, initiative","","","The company provides training on code of conduct, adaptive leadership, and effective coaching to employees.","Topics covering code of conduct, adaptive leadership programmes, and effective coaching."
2022,20,"4.",5,"moderate","In progress","SDG 13","policy, initiative","","","The company has adopted Best Available Technologies (BAT) to improve the environmental impact of its operations.","We have adopted the Best Available Technologies (BAT) to improve the of our operations on climate."
2022,15,"5. Details on assessment of value chain partners:",5,"moderate","In progress","SDG 8, SDG 12","policy, initiative","","","The company has implemented a vendor registration tool that requires suppliers to disclose information about their social and environmental practices.","We have developed vendor and supplier registration tool in which we have provided questionnaires so that every new supplier/distributor has to disclose the social and environment parameters such as licence to operate industrial H&S department, consent from the respective state pollution control boards, ISO certifications, etc."
2022,13,"b.",5,"moderate","In progress","SDG 8","policy, initiative","","","The company implements an OH&S Management system compliant with ISO 45001:2018.","• OH&S Management system implemented at our plants is complying with ISO 45001:2018."
2022,13,"b.",5,"moderate","In progress","SDG 8, SDG 9","initiative, target","","","The company promotes technology interventions for hazard identification using smart cameras, geofencing, and sensors.","• Technology interventions in Hazard Identification is being promoted extensively through use of smart cameras, Geo fencing, Sensors in Men-Machine interface etc.,"
2022,13,"b.",5,"moderate","In progress","SDG 8","initiative, target","","","The company developed critical safety rules based on accident history and communicated them through a 3D animated video.","• JSW Critical Safety Rules was developed based on the criticality and past history of accidents. This was cascaded through development of a 3 D animated video."
2022,4,"22. (i) Whether CSR is applicable as per section 135 of Companies Act, 2013: (Yes/No) – Yes (ii) Turnover (in ` ) – consolidated gross turnover: ` 143,829 crore, Standalone Gross Turnover: `",4,"moderate","Planned","SDG 7, SDG 13, SDG 6, SDG 12, SDG 15","target, kpi","","","The company has set targets for sustainability KPIs related to various SDGs.","JSW Steel has set targets for Sustainability KPIs related to climate change, energy, water, waste, air emissions and biodiversity for 2030."
2022,4,"22. (i) Whether CSR is applicable as per section 135 of Companies Act, 2013: (Yes/No) – Yes (ii) Turnover (in ` ) – consolidated gross turnover: ` 143,829 crore, Standalone Gross Turnover: `",4,"moderate","In progress","SDG 17","governance","","✓","A committee has been established to oversee the company's sustainability performance.","The Board of Directors have constituted a sub-committee of the Board known as the “Business Responsibility/Sustainability Reporting Committee”which is responsible for the overall Sustainability performance of the company."
2022,15,"5. Details on assessment of value chain partners:",4,"moderate","In progress","SDG 3, SDG 4, SDG 10","initiative","","","The company states its work focuses on education, health, nutrition, sanitation, and well-being of marginalized communities.","JSW has been working for education, health & nutrition, sanitation and wellbeing of marginalised sections of the society."
2022,15,"5. Details on assessment of value chain partners:",4,"moderate","In progress","SDG 8, SDG 11","initiative","","","The company aims to improve the quality of life for people affected by its operations through various programs.","JSW Steel focuses on strengthening its relationships with the communities through a meaningful and purposeful engagement. It implements a range of programmes that enables improved quality of life for people who are impacted by its operations."
2022,20,"4.",4,"moderate","Planned","SDG 13","target","✓","","The company has set a target to reduce CO2 emissions by 42% by 2030.","We have set ourselves an ambitious CO2 emission reduction target of 42% reduction over a base year of 2005 till 2030."
2022,20,"4.",4,"moderate","In progress","SDG 13","initiative","","","The company has adopted Best Available Technologies (BAT) to improve its operations' impact on climate.","We have adopted the Best Available Technologies (BAT) to improve the of our operations on climate."
2022,7,"11.",4,"moderate","In progress","SDG 12, SDG 13, SDG 15, SDG 17","aspiration, initiative","","","The company raises awareness about various sustainability topics through internal communication and initiatives.","Awareness by way of periodical internal communication -Delivering value from ESG, Sustainability Initiatives at locations, Actions & Initiatives of JSW Foundation, Environment Initiatives at locations, Life Cycle Assessment & Product Sustainability, Biodiversity & its importance for Business, Social Interventions for Sustainable World & Safety Management."
2022,20,"4.",4,"moderate","Planned","SDG 13","target, aspiration","✓","","The company aims to reduce CO2 emissions below 1.95tCO2/tcs by 2030, aligning with the global sustainable development scenario (SDS) pathway.","This will bring down the CO2 levels below 1.95tCO2/tcs. This target is aligned with the global sustainable development scenario (SDS) pathway."
2022,6,"Principle-Wise Policies",4,"moderate","In progress","SDG 17","governance","","✓","The company has a sustainability committee that meets twice a year to review progress on sustainability parameters.","The board sustainability committee meets twice in a year to discuss the progress against sustainability parameters of the company and review the polices."
2022,6,"Principle-Wise Policies",4,"moderate","In progress","SDG 12, SDG 13, SDG 17","policy","","","The company reports no major non-compliances with statutory requirements related to sustainability principles.","No major non-compliance. Operational issues are being addressed on an ‘ongoing basis’ as and when identified"
2022,15,"5. Details on assessment of value chain partners:",4,"moderate","In progress","SDG 8, SDG 16","initiative","","","The company has a structured grievance redressal mechanism that allows stakeholders to raise concerns, including those related to human rights.","It has a structured stakeholder grievance redressal mechanism through which stakeholders freely share their concerns and grievances with the Company, including regarding human rights issues."
2022,15,"5. Details on assessment of value chain partners:",4,"moderate","In progress","SDG 16","governance","","✓","The company has a stakeholder relationship committee that oversees the grievance redressal system and reports serious concerns.","Company have stakeholder relationship committee to periodically look into the functioning of the Company’s shareholder/ investor grievance redressal system and oversee improvements in the same, besides reporting serious concerns, if any."
2022,27,"6. Details of beneficiaries of CSR Projects:",4,"moderate","In progress","SDG 1, SDG 10","initiative","","","The company's CSR programs primarily benefit vulnerable and marginalized communities due to their location in tribal areas.","By virtue of working in areas with predominantly tribal communities, the programs by default reach out largely to the vulnerable and marginalised communities."
2022,25,"2.",4,"moderate","Planned","SDG 8, SDG 9, SDG 12, SDG 16, SDG 17","policy, initiative","","","JSW Steel participates in industry associations and working groups to influence policy in areas related to sustainable development.","JSW Steel works closely with industry/trade associations in evolving policies that govern the functioning and regulations of the Indian Steel sector. The company is a member of various working groups to support the government in the following areas - • Governance and administration • Economic Reforms • Sustainabile business principles • Energy, water and other natural resources • Social and community development • Transparency in public disclosure"
2022,13,"b.",4,"moderate","In progress","SDG 8","initiative","","","The company launched a 'Safety Hero Program' to recognize employees who demonstrate safety consciousness.","• Safety Hero Program was launched to recognise safety conscious persons amongst shop floor workmen and employees."
2022,15,"5. Details on assessment of value chain partners:",4,"moderate","In progress","SDG 8, SDG 12","initiative","","","The company conducts regular field safety audits of all contractors at least every two weeks.","Contractor Field Safety Audit of all contractors are being conducted regularly at least every fortnight."
2022,4,"22. (i) Whether CSR is applicable as per section 135 of Companies Act, 2013: (Yes/No) – Yes (ii) Turnover (in ` ) – consolidated gross turnover: ` 143,829 crore, Standalone Gross Turnover: `",3,"moderate","Planned","SDG 13","policy, aspiration","","","The company is transitioning to a greener business and adopting the TCFD framework.","transitioning to a greener and more climate resilient business, we have adopted the Task Force on Climate-related Financial Disclosures (TCFD) framework and are working towards alignment with its recommendations."
2022,4,"22. (i) Whether CSR is applicable as per section 135 of Companies Act, 2013: (Yes/No) – Yes (ii) Turnover (in ` ) – consolidated gross turnover: ` 143,829 crore, Standalone Gross Turnover: `",3,"moderate","Planned","SDG 13","policy, aspiration","","","The company is a signatory to the TCFD and working to identify climate risks and opportunities for decarbonization.","The Company is a signatory to the TCFD for climate change and in the process to fully identify the transition risks and opportunities to decarbonise its operations over a period of time."
2022,4,"22. (i) Whether CSR is applicable as per section 135 of Companies Act, 2013: (Yes/No) – Yes (ii) Turnover (in ` ) – consolidated gross turnover: ` 143,829 crore, Standalone Gross Turnover: `",3,"moderate","Planned","SDG 13","governance","","✓","The company's board and senior management are actively involved in defining and steering climate actions.","In this regard, our Board members and senior management take an active role in defining and steering the Company’s climate actions."
2022,4,"22. (i) Whether CSR is applicable as per section 135 of Companies Act, 2013: (Yes/No) – Yes (ii) Turnover (in ` ) – consolidated gross turnover: ` 143,829 crore, Standalone Gross Turnover: `",3,"moderate","Planned","SDG 13","governance","","✓","All levels of the company's governance structure participate in assessing climate change risks and opportunities.","Every level of our governance structure participates in assessing the risks and opportunities that climate change poses to the Company."
2022,15,"5. Details on assessment of value chain partners:",3,"moderate","Mention only","SDG 16","policy, governance","","✓","The company has a whistleblower policy to address unethical behavior and violations.","We formulated the whistleblower policy / vigil mechanism in order to provide a mechanism for Directors and employees of JSW Steel to approach the Ethics Counsellor/ Chairman of the Audit Committee of the Board to report genuine concerns about unethical behaviour, actual or suspected fraud or violation of the Code of Conduct or Ethics Policy, or any other unethical or improper activity."
2022,19,"2. Details of the scope and coverage of any Human rights due-diligence conducted. We propose to carry out the assessment in the near future. 3.",3,"moderate","Mention only","SDG 7","kpi","✓","","The company reports its total electricity consumption for the current and previous financial years.","Total electricity consumption (A) 11703082 GJ 8275323.6 GJ"
2022,12,"5. Return to work and Retention rates of permanent employees and workers that took parental leave.",3,"moderate","Mention only","SDG 8","policy","✓","","11.05% of the workforce is represented through employee associations.","11.05% of workforce represented through employee association(s) under the provision of collective bargaining."
2022,12,"5. Return to work and Retention rates of permanent employees and workers that took parental leave.",3,"moderate","Mention only","SDG 4, SDG 8","kpi","✓","","Permanent employees received an average of 17.37 training hours.","Permanent Employees – 17.37"
2022,15,"5. Details on assessment of value chain partners:",2,"weak","Mention only","SDG 8, SDG 12","aspiration, policy","","","The company states its commitment to promoting responsible behavior and social and environmental wellbeing through a business conduct policy.","JSW Steel is committed to promoting responsible behavior and value for social and environmental wellbeing. To this end, it has a policy on business conduct that is applicable to all its employees and value chain partners."
2022,27,"6. Details of beneficiaries of CSR Projects:",2,"weak","Mention only","SDG 9","policy","","","The company has a formal policy on information security management.","The company has a formal policy on Information security Management and a manual of all the relevant policies is available in the company."
2022,15,"5. Details on assessment of value chain partners:",2,"weak","Mention only","SDG 5","policy","","","The company has a non-discriminatory policy framework that promotes equal opportunity for all.","It provides a rules-based policy framework that is non-discriminatory and provides equal opportunity for all individuals irrespective of their gender, religion, caste, race, age, community, physical ability or gender orientation."
2022,15,"5. Details on assessment of value chain partners:",2,"weak","Mention only","SDG 12","initiative","","","The company engages with suppliers to promote responsible business practices.","We engage regularly with our suppliers to ensure that our overall ecosystem functions with a sense of responsibility, integrity and overall compliance."
2022,15,"5. Details on assessment of value chain partners:",2,"weak","Mention only","SDG 8, SDG 12, SDG 16","policy","","","The company's Supplier Code of Conduct (SCoC) incorporates UN Global Compact principles.","This SCoC takes cognisance of the themes of human rights, labour, environment, and anti-corruption, as described in the United Nations Global Compact (UNGC)."
2022,15,"5. Details on assessment of value chain partners:",2,"weak","Mention only","SDG 5, SDG 8, SDG 10","policy, aspiration","","","The company states its commitment to promoting inclusivity, equality, and safeguarding human rights.","We are fully committed to promoting inclusivity and equality, prohibiting any discrimination and safeguarding the human rights of all our teams."
2022,15,"5. Details on assessment of value chain partners:",2,"weak","Mention only","SDG 1, SDG 16","policy, aspiration","","","The company affirms its belief in human rights and commitment to protecting them through a human rights policy.","We believe that every human being has the right to equality and non-discrimination. We respect human rights and are committed to ensuring that they are protected, guided by our human rights policy."
2022,15,"5. Details on assessment of value chain partners:",2,"weak","Mention only","SDG 5, SDG 8, SDG 10","policy","","","The company states it has a policy in place to protect human rights and promote inclusivity, diversity, and equality.","We have formulated a policy to demonstrate our commitment to protecting and enhancing the human rights of individuals and promoting inclusivity, diversity and equality."
2022,7,"11.",2,"weak","Mention only","SDG 13, SDG 15, SDG 6","governance","","✓","The company's board of directors discusses topics related to various sustainability principles, including climate change, biodiversity, and water.","The topics covered include the Committee Meetings which have discussions topics on all principles of BRSR including climate change, biodiversity, water, Sustainability Key Performance Indicators, Global trends on sustainability and best Practices in industry, external ratings and disclosures, Stakeholder engagement and Materiality, climate change Risks and Opportunities etc."
2022,19,"2. Details of the scope and coverage of any Human rights due-diligence conducted. We propose to carry out the assessment in the near future. 3.",2,"weak","Mention only","SDG 10","policy","","","The company states that its premise/office is accessible to differently abled visitors.","Is the premise/office of the entity accessible to differently abled visitors, as per the requirements of the Rights of Persons with Disabilities Act, 2016? Yes"
2022,12,"5. Return to work and Retention rates of permanent employees and workers that took parental leave.",2,"weak","Mention only","SDG 5","initiative","","","The company conducted various awareness trainings on gender equality and women's empowerment.","• Sessions with men as gender advocates
• Gender sensitisation session
• POSH
• JSW Springboard – IIM Bangalore Women Leadership Journey 
• JSW Women Network Forum – Vibe"
2022,15,"5. Details on assessment of value chain partners:",2,"weak","Mention only","SDG 17","policy","","","The company describes its stakeholder engagement process, considering the influence of each group on the company's ability to create value.","JSW Steel maintains a dynamic and strategic stakeholder engagement process where it identifies key stakeholder groups from the larger universe of all possible stakeholders. This is done after considering the material influence each group has on the Company’s ability to create value (and vice-versa)."
2022,15,"5. Details on assessment of value chain partners:",2,"weak","Mention only","SDG 17","policy","","","The company lists seven identified stakeholder groups, including employees, government, customers, communities, suppliers, institutions, and investors.","Through this mechanism, the Company has currently identified seven internal and external stakeholder groups: Employees, Government and Regulatory Authorities, Customers, Communities and Civil Society / NGOs, Suppliers, Institutions, Investors."
2022,20,"4.",1,"weak","Mention only","SDG 13","aspiration","","","The company's CO2 reduction target aligns with the global sustainable development scenario (SDS) pathway.","This target is aligned with the global sustainable development scenario (SDS) pathway."
2022,15,"5. Details on assessment of value chain partners:",1,"weak","Mention only","SDG 5","aspiration","","","The company promotes diversity and inclusion as a core value.","The Company believes in promoting diversity & inclusion as a culture which allows all employees to bring their authentic selves to work and contribute wholly with their skills, experience and perspective for creating unmatched value for all stakeholders."
2023,4,"22. (i) Whether CSR is applicable as per section 135 of Companies Act, 2013: (Yes/No) – Yes (ii) Turnover (in",8,"strong","Measurable","SDG 6","initiative, measured_outcome","✓","","The company states its Zero Liquid Discharge (ZLD) status and its benefits.","We uphold our Zero Liquid Discharge (ZLD) status across all our steel manufacturing locations. Following the ZLD process, we have achieved cost savings, mitigated water acquisition risks and achieved overall better environmental performance and compliance."
2023,25,"4.",7,"strong","In progress","SDG 9, SDG 13","initiative, measured_outcome","✓","","The company operates a Carbon Capture and Utilization (CCU) facility with a capacity of 100TPD, capturing CO2 for use in the food & beverage industry.","We are operating a CCU of 100TPD capacity where CO2 is captured and refined for use in the food & beverage industry."
2023,32,"3. (a)",7,"strong","In progress","SDG 1, SDG 2, SDG 3, SDG 4, SDG 5, SDG 8, SDG 10","initiative, measured_outcome","✓","","The company reports on the number of beneficiaries of their CSR projects, with 75% coming from vulnerable and marginalized groups.","6. Details of beneficiaries of CSR Projects: S. No. CSR Project No. of persons benefited from CSR Projects % of beneficiaries from vulnerable and marginalised group 1. Health & Nutrition: Focusing mother & child health and well-being of the community 303256 75.00 2. Education and Learning: Improving standards & quality of delivery of education 102420 75.00 3. Agri-initiatives: Aiming for sustainable prosperity of farming communities 10500 75.00 4. Livelihood: Empowering women, fueling growth 25640 75.00 5. Waste Management 114944 75.00 6. Water conservation and augmentation: Conserving for better tomorrow 55175 75.00 7. Margdarshak: Facilitating Social Entitlements 178944 75.00"
2023,4,"22. (i) Whether CSR is applicable as per section 135 of Companies Act, 2013: (Yes/No) – Yes (ii) Turnover (in",6,"strong","In progress","SDG 13","policy, initiative, target","","","The company has set decarbonization targets, a climate change policy, and a dedicated group to drive climate action.","We have developed clear targets for decarbonisation, have a dedicated climate change policy, and instituted a Climate Action Group to drive the organisation’s climate action agenda."
2023,4,"22. (i) Whether CSR is applicable as per section 135 of Companies Act, 2013: (Yes/No) – Yes (ii) Turnover (in",6,"strong","In progress","SDG 13","policy, target, kpi","","","The company states its commitment to mitigating air emissions through policies, targets, and monthly assessments.","We are committed to preventing, abating and mitigating our emissions to air and have dedicated policies addressing point and non-point source emissions. Annual targets are created, and assessment is done monthly."
