"Year","Page","Section","Score","Strength","Stage","SDGs","Tags","Quant","Oversight","Summary","Text"
2020,114,"Biodiversity",8,"strong","Measurable","SDG 13, SDG 15","initiative, measured_outcome","✓","","The company has undertaken plantation activities in collaboration with the Karnataka State Forest department, resulting in increased forest cover.","Plantation activities in adjoining reserve forest along with the Karnataka State Forest department Land development and forest cover increase; 33% land developed with plantation"
2020,114,"Biodiversity",8,"strong","Measurable","SDG 13, SDG 14, SDG 15","initiative, measured_outcome","✓","","The company planted 349,970 mangrove saplings as part of a recognized project, which benefits farmers by protecting agricultural land.","Planted 3,49,970 mangrove saplings as a part of the Mangrove Restoration Project, which has also been recognised by India Business and Biodiversity Initiative (IBBI) Benefits to farmers as mangroves hold the soil and prevent ingress of salt water into agricultural land"
2020,173,"CLIMATE ACTION GROUP",7,"strong","In progress","SDG 3, SDG 8","policy, initiative, target","","✓","JSW Group aims for 'Zero Harm' across its businesses and implements initiatives to achieve this goal.","Ensuring the health and safety of people at all its workplaces is also a key goal to the Company’s business responsibility vision. JSW Group targets to achieve ‘Zero Harm’ across its businesses and continues to implement initiatives under the ‘VISION 000’ motto."
2020,112,"STRATEGIC FOCUS AREAS > S6 Air emissions",7,"strong","In progress","SDG 3, SDG 9, SDG 13","initiative, target, kpi","✓","","The company installed de-dusting systems to reduce PM emissions to less than 2mg/m3.","Vijayanagar — Installation of de-dusting systems designed to achieve a work zone guarantee of <2mg/m3 of PM emissions
Improvement of any means by which air emissions are treated on the sites, subsequently enhancing the quality of any eventual air emissions"
2020,173,"CLIMATE ACTION GROUP",6,"strong","Planned","SDG 13","policy, initiative, target","","✓","The Climate Action Group meets regularly to discuss climate change mitigation strategies, research needs, and long-term action plans.","The CAG meets at least once every month with the primary objectives of discussing actions on policy advocacy with external stakeholders, analysis of climate change risks and devising mitigation strategies for each operating unit, identifying R&D needs, developing targets and formulating long-term action plans"
2020,26,"FROM THE CMD’S DESK Emerging stronger and better every day",6,"strong","In progress","SDG 1, SDG 8, SDG 10","initiative, target","✓","","The JSW Foundation works in 255 villages across four states to empower communities and create sustainable livelihoods.","The JSW Foundation continued to make a positive difference across 255 villages in four states, aligned with our vision to ‘empower communities to create sustainable livelihoods’."
2020,173,"CLIMATE ACTION GROUP",5,"moderate","In progress","SDG 9, SDG 12","initiative, target","","","JSW Steel implemented initiatives to minimize waste generation and implemented technologies to recover iron from waste slime, reducing iron ore consumption.","During FY 2019-20, JSW Steel launched several initiatives across its manufacturing units to minimise waste generation and responsible disposal of generated waste. The Company has implemented innovative technologies to recover iron from the waste slime generated, thereby reducing consumption of iron ore."
2020,173,"CLIMATE ACTION GROUP",5,"moderate","In progress","SDG 15","initiative, target","","","JSW Steel prioritizes biodiversity preservation through initiatives that engage with local communities and government bodies.","Preservation of biodiversity is also an important objective of the Company. Precautions are taken to reduce negative impacts on the ecosystem. The Company has various initiatives where it engages with the local population and government bodies to preserve biodiversity in its operations, especially in the eco-sensitive areas."
2020,26,"FROM THE CMD’S DESK Emerging stronger and better every day",5,"moderate","In progress","SDG 3","initiative, policy","","","The company integrates Health & Safety (H&S) as a core value and implements initiatives under the 'VISION 000' motto.","In order to help us reach this vision, we have fully integrated Health & Safety (H&S) as one our core Group values and are continuing to implement initiatives under the ‘VISION 000’ motto."
2020,26,"FROM THE CMD’S DESK Emerging stronger and better every day",5,"moderate","In progress","SDG 1, SDG 2, SDG 3, SDG 4, SDG 5, SDG 6, SDG 10","initiative, target","","","The company's CSR initiatives focus on key areas like health, education, skills development, and community empowerment.","Our CSR initiatives are focused on key intervention areas of health and nutrition, skills and livelihoods, education, water, sanitation and community empowerment."
2020,97,"Key performance indicators",5,"moderate","In progress","SDG 13","initiative, governance","","✓","The company has established a Climate Action Group to address climate change.","In light of the rapid developments related to climate change within technology, regulations, taxation and stakeholders’ growing expectations, JSW Steel has constituted a Climate Action Group (CAG) with cross-functional expertise encompassing R&D, strategy, operations, communications etc."
2020,112,"STRATEGIC FOCUS AREAS > S6 Air emissions",5,"moderate","In progress","SDG 9, SDG 13","initiative, target","","","The company installed monitoring systems to assess air emissions from its sites.","Notable interventions and intended outcomes aligned to the policy objectives
INTERVENTIONS
OUTCOMES
Vijayanagar — Installation of online continuous emission monitoring systems, 18 effluent monitoring devices at six locations and PTZ-cameras
Enhanced and continuous assessment of all air emissions from sites to determine their origin"
2020,94,"COMMITTED TO RESPONSIBLE STEWARDSHIP Our approach Steel is a resource-intensive industry that has a strong reliance on natural capital. The process of steelmaking involves complex activities that require heavy energy utilisation and effective waste and emissions management. As a large-scale steelmaker, we are mindful of the impact our operations have",5,"moderate","In progress","SDG 7, SDG 12","initiative, target","","","The company seeks to improve energy efficiency and recover waste heat during its operations.","During our operations, we strive to achieve maximum energy efficiency and recover waste heat for use in the process."
2020,94,"COMMITTED TO RESPONSIBLE STEWARDSHIP Our approach Steel is a resource-intensive industry that has a strong reliance on natural capital. The process of steelmaking involves complex activities that require heavy energy utilisation and effective waste and emissions management. As a large-scale steelmaker, we are mindful of the impact our operations have",5,"moderate","In progress","SDG 13","initiative, target","","","The company is aware of its carbon footprint and has implemented measures to reduce CO2 emissions.","We are equally aware of our carbon footprint and have taken active steps to reduce CO2 emissions through the deployment of state-of-the-art equipment and technology-led systems."
2020,94,"COMMITTED TO RESPONSIBLE STEWARDSHIP Our approach Steel is a resource-intensive industry that has a strong reliance on natural capital. The process of steelmaking involves complex activities that require heavy energy utilisation and effective waste and emissions management. As a large-scale steelmaker, we are mindful of the impact our operations have",5,"moderate","In progress","SDG 3, SDG 13","policy, initiative","","","The company limits its emissions of PM, SOx, and NOx to levels below regulatory requirements.","We also restrict our Particulate Matter (PM), SOx and NOx emissions to levels below statutory limits by use of best available technologies (BAT), conscious of their possible impact on the local environment."
2020,167,"Key focus areas for JSW Steel in a post-COVID world",5,"moderate","In progress","SDG 7, SDG 13","initiative, target","","","The company is implementing plans to reduce carbon footprints by replacing thermal coal with renewable energy sources.","JSW Steel remains committed in its efforts to reduce carbon footprints, as it is implementing plans to ensure zero usage of thermal coal, and thereby replacing coal with renewable source of energy for generating power in the steel operations."
2020,167,"Key focus areas for JSW Steel in a post-COVID world",5,"moderate","In progress","SDG 7, SDG 13","initiative, target","","","The company is undertaking initiatives and research to reduce the intensity of metallurgical coal usage.","Further a lot of initiatives and ongoing research and development activities are underway to reduce the intensity of metallurgical coal usage in the Company’s blast furnaces."
2020,210,"DIRECTORS’ REPORT",5,"moderate","In progress","SDG 2, SDG 3","initiative","","✓","The company focuses on strengthening public health and nutrition, particularly for mothers, children, and adolescent girls.","Strengthening public health and nutrition with special focus on mothers, children & adolescent girls."
2020,210,"DIRECTORS’ REPORT",5,"moderate","In progress","SDG 6, SDG 1","initiative","","✓","The company implements comprehensive water management to achieve sustainable environments and support agricultural livelihoods.","Comprehensive water management leading not only to sustainable environment but also sustained agri-livelihoods, in turn affecting nutrition and poverty."
2020,210,"DIRECTORS’ REPORT",5,"moderate","In progress","SDG 5","initiative","","✓","The company empowers women through initiatives like rural BPOs and self-help groups.","Empowerment of women through JSW Shakti initiatives, i.e. (Rural BPO for women, promoting Self-Help Groups etc.)."
2020,210,"DIRECTORS’ REPORT",5,"moderate","In progress","SDG 4","initiative","","✓","The company improves rural education through infrastructure, training, and capacity building.","Improving quality education in rural schools through infrastructure, training methodology and capacity building initiatives."
2020,210,"DIRECTORS’ REPORT",5,"moderate","In progress","SDG 6, SDG 12","initiative","","✓","The company focuses on sanitation and waste management, particularly addressing single-use plastic waste.","Sanitation and waste management, single use plastic waste in particular."
2020,48,"RISK MANAGEMENT",5,"moderate","In progress","SDG 7, SDG 13","initiative, target","","","The company describes its efforts to increase the use of captive power plants, self-generation, and energy efficiency measures.","› Substantial portion of the power requirements are increasingly being met through Captive Power Plants (CPPs) › The power required would be met partly through self-generation from coke oven / blast furnace gases and balance under long-term power purchase agreements through open access › Enhance our power transmission capacity › Complying with all applicable norms through use of best-in-class technology › Selecting the right equipment, technology, processes, inputs and tracking emissions."
2020,209,"FINANCIAL STATEMENTS",5,"moderate","In progress","SDG 6","initiative","✓","","The company installed effluent monitoring devices at multiple locations in Vijayanagar.","In Vijayanagar, 18 effluent monitoring devices were installed at six locations."
2020,209,"FINANCIAL STATEMENTS",5,"moderate","In progress","SDG 6","initiative","✓","","Treating blast furnace recirculation water reduces water consumption and improves water quality.","This helps reduce the pH of the water and hardness. It also reduces the total dissolved solids (TDS) in outlet effluent, resulting in lower water consumption."
2020,209,"FINANCIAL STATEMENTS",5,"moderate","In progress","SDG 6","initiative","✓","","An effluent treatment plant was installed in Salem with a capacity to treat wastewater and reduce fresh water consumption.","Effluent Treatment Plant installed at the Salem facility with a capacity of 125 KLD and a Zero Liquid Discharge system in Acid pickling plant to treat the effluent. This will help reduce fresh water consumption by approximately 85 KLD."
2020,97,"Key performance indicators",4,"moderate","Planned","SDG 13","target","✓","","The company commits to reducing specific greenhouse gas emissions by 2030.","WE COMMIT TO REDUCING SPECIFIC GHG EMISSIONS (SCOPE 1 AND SCOPE 2) FROM THE THREE INTEGRATED STEEL PLANTS TO 2.0 tC02/tcs by 2030"
2020,91,"Material issues",4,"moderate","Planned","SDG 7, SDG 9, SDG 12, SDG 13","initiative, target","","","The company aims to improve energy efficiency, support decarbonization, and promote a circular economy.","Improve energy efficiency, and support decarbonisation and circular economy"
2020,96,"Climate change",4,"moderate","Planned","SDG 13","policy, initiative","","","The company states it has established a climate change policy with commitments to prevent climate change and build resilience.","As part of our efforts to remain focused on climate change issues to support delivering our Sustainability Vision, we have established a climate change policy that includes our commitments on the following: Prevention of the causes of climate change Creating resilience to climate change"
2020,114,"Biodiversity",4,"moderate","In progress","SDG 1, SDG 8","initiative","","","The company undertakes projects through JSW Foundation to support community self-sustenance and employment.","We undertake specific projects through JSW Foundation, involving communities for self-sustenance and employment generation."
2020,114,"Biodiversity",4,"moderate","In progress","SDG 13, SDG 15","initiative","","","The company is a member of the India Business and Biodiversity Initiative (IBBI) working group.","We are also a Working Group (WG) member of the India Business and Biodiversity Initiative (IBBI) Chapter of CII-CESD."
2020,48,"RISK MANAGEMENT",4,"moderate","Planned","SDG 13","policy, initiative","","","The company states that planned expansions require adherence to environmental regulations and assessments.","For planned capacity expansion projects, there is a need to adhere to legal requirements such as environmental assessments, environmental impact studies and/or plans of development before commencing production activities."
2020,48,"RISK MANAGEMENT",4,"moderate","Planned","SDG 9, SDG 13","initiative, target","","","The company plans to invest in technologies to reduce dust emissions and manage waste from its operations.","Additional capex allocation for advanced technologies such as Maximised Emission Reduction of Sintering (MEROS) in sinter to further reduce dust emissions › Exploring use of steam box ageing technology to treat Basic Oxygen Furnace (BOF) slag that would be generated after proposed expansions at Vijayanagar and Dolvi"
2020,210,"DIRECTORS’ REPORT",4,"moderate","Planned","SDG 13","aspiration, initiative","✓","","The company aims to plant one million trees in collaboration with the Forest Department.","The Company has set a goal to plant one million trees in collaboration with the Forest Department in nearby degraded forest areas at Dolvi and Karav."
2020,209,"FINANCIAL STATEMENTS",4,"moderate","In progress","SDG 6","initiative","","","The company uses RO plants to recover and reuse water, achieving zero liquid discharge.","Vijayanagar uses six RO plants for recovery of makeup water and reuses treated blowdown water for secondary applications, thereby ensuring zero liquid discharge."
2020,209,"FINANCIAL STATEMENTS",4,"moderate","In progress","SDG 6","initiative","","","Wastewater in Salem is treated and reused for plant operations.","In Salem, wastewater from Ultrafiltration RO Plant and Multigrade Filter is diverted to recycled water treatment plants. The recycled water is reused for plant makeup water."
2020,97,"Key performance indicators",3,"moderate","Planned","SDG 13","target","","","The company commits to achieving carbon neutrality at JSW Steel Coated Products Ltd. by 2030.","WE ALSO COMMIT TO ACHIEVING CARBON NEUTRALITY AT JSW STEEL COATED PRODUCTS LTD. BY 2030"
2020,91,"Material issues",3,"moderate","Planned","SDG 3, SDG 8","initiative","","","The company aims to maintain the highest safety and well-being standards for all employees.","Maintain the highest standards of safety and well-being of all employees"
2020,91,"Material issues",3,"moderate","Planned","SDG 1, SDG 2, SDG 3, SDG 8, SDG 10, SDG 11","initiative","","","The company aims to make a positive impact on the lives of people in communities surrounding their operations.","Make a tangible difference in the lives of people in the areas surrounding our operations"
2020,94,"COMMITTED TO RESPONSIBLE STEWARDSHIP Our approach Steel is a resource-intensive industry that has a strong reliance on natural capital. The process of steelmaking involves complex activities that require heavy energy utilisation and effective waste and emissions management. As a large-scale steelmaker, we are mindful of the impact our operations have",3,"moderate","Planned","SDG 13","aspiration, policy","","","The company acknowledges the environmental impact of its operations and aims to minimize its footprint.","As a large-scale steelmaker, we are mindful of the impact our operations have on the environment and attempt to minimise our environmental footprint throughout our integrated operations."
2020,48,"RISK MANAGEMENT",3,"moderate","Planned","SDG 13","policy","","","The company acknowledges the potential need for investments and operational changes to comply with stricter environmental regulations.","Compliance with new and more stringent environmental obligations relating to Greenhouse Gas (GHG) emissions may require additional capital expenditures or modifications in operating practices, as well as additional reporting obligations."
2020,93,"Our sustainability framework, policy and focus areas",2,"weak","Mention only","SDG 1, SDG 2, SDG 3, SDG 4, SDG 5, SDG 6, SDG 7, SDG 8, SDG 9, SDG 10, SDG 11, SDG 12, SDG 13, SDG 14, SDG 15, SDG 16, SDG 17","policy","","","The company states they reviewed existing policies, globally relevant guidelines and frameworks, including the UN SDGs, when determining their focus areas.","We determined our focus areas by reviewing our existing set of sustainability policies. We examined globally relevant guidelines and frameworks that can apply to our operations and took into account the relevant requirements as applicable to our operations while formulating the policies."
2020,26,"FROM THE CMD’S DESK Emerging stronger and better every day",2,"weak","Mention only","SDG 1, SDG 2, SDG 3, SDG 4, SDG 5, SDG 6, SDG 7, SDG 8, SDG 9, SDG 10, SDG 11, SDG 12, SDG 13, SDG 14, SDG 15, SDG 16, SDG 17","aspiration, policy","","","The company has established a sustainability framework with 17 focus areas aimed at creating a significant impact.","This year we also outlined a comprehensive sustainability framework comprising 17 core focus areas, where we can create significant impact."
2020,26,"FROM THE CMD’S DESK Emerging stronger and better every day",2,"weak","Mention only","SDG 3","aspiration, policy","","","The company prioritizes the safety and well-being of its employees, aiming for 'Zero Harm'.","The safety and well-being of our people is of paramount importance to us. At JSW Group, our vision is to achieve ‘Zero Harm’."
2020,112,"STRATEGIC FOCUS AREAS > S6 Air emissions",2,"weak","Mention only","SDG 3, SDG 9, SDG 13","policy","","","The text states that air pollution has led to regulations controlling emissions.","Deterioration of air quality, acidification, forest degradation and public health concerns have led to local and international regulations to control emissions of pollutants such as PM, SOx and NOx."
2020,112,"STRATEGIC FOCUS AREAS > S6 Air emissions",2,"weak","Mention only","SDG 12, SDG 13","aspiration, policy","","","The company acknowledges its responsibility to reduce air emissions beyond regulatory requirements.","By virtue of the industry that we operate in, we generate different polluting air emissions, which have been controlled according to prescribed regulatory norms. However, we recognise that we have definite moral and social obligations to do more in this respect."
2020,91,"Material issues",2,"weak","Mention only","SDG 1, SDG 8, SDG 11, SDG 12, SDG 13, SDG 17","aspiration, policy","","","The company states that sustainability is at the core of their corporate strategy and they strive to be a force for good.","With sustainability at the core of our corporate strategy, we strive to be a force for good, driven by responsible business conduct that enhances the lives of communities and nurtures the environment."
2020,167,"Key focus areas for JSW Steel in a post-COVID world",2,"weak","Mention only","SDG 1, SDG 2, SDG 3, SDG 4, SDG 5, SDG 6, SDG 7, SDG 8, SDG 9, SDG 10, SDG 11, SDG 12, SDG 13, SDG 14, SDG 15, SDG 16, SDG 17","aspiration, policy","","","The company has a sustainability framework with 17 focus areas.","The Company outlined a comprehensive sustainability framework comprising 17 core focus areas, where it creates a significant impact."
2020,96,"Climate change",2,"weak","Mention only","SDG 13","policy","","","The text highlights the global recognition of climate change as a major challenge and the international efforts to address it.","Climate change has emerged as one of the paramount perils of the 21st century, with nations across the world formulating their own policies and also deepening multilateral dialogue and coordination among themselves to arrest its impact on economies and society."
2020,96,"Climate change",2,"weak","Mention only","SDG 13","policy","","","The text mentions the need for industries like steel to actively reduce their carbon emissions.","Further, there is a call for active decarbonisation by industries such as steel, which have historically contributed to large-scale carbon emissions."
2020,130,"Social sustainability",1,"weak","Mention only","SDG 1, SDG 8, SDG 10","aspiration","","","JSW Steel aims to empower communities to achieve sustainable livelihoods.","JSW Steel has a vision to ‘Empower communities to create sustainable livelihoods’."
2020,93,"Our sustainability framework, policy and focus areas",1,"weak","Mention only","SDG 1, SDG 2, SDG 3, SDG 4, SDG 5, SDG 6, SDG 7, SDG 8, SDG 9, SDG 10, SDG 11, SDG 12, SDG 13, SDG 14, SDG 15, SDG 16, SDG 17","aspiration","","","The company lists the UN Sustainable Development Goals as one of the key guidelines and frameworks they consider.","The key guidelines and frameworks that we have taken into consideration are: › United Nations Sustainable Development Goals (UN SDGs)"
2020,144,"SDG LOCATION(S) PAGE NUMBER",1,"weak","Mention only","SDG 1","aspiration","","","The company states its commitment to ending poverty.","End poverty in all its forms everywhere."
2020,144,"SDG LOCATION(S) PAGE NUMBER",1,"weak","Mention only","SDG 2","aspiration","","","The company aims to end hunger and promote sustainable agriculture.","End hunger, achieve food security and improved nutrition, and promote sustainable agriculture."
2020,144,"SDG LOCATION(S) PAGE NUMBER",1,"weak","Mention only","SDG 3","aspiration","","","The company is committed to ensuring healthy lives and well-being for all.","Ensure healthy lives and promote well-being for all at all ages."
2020,144,"SDG LOCATION(S) PAGE NUMBER",1,"weak","Mention only","SDG 4","aspiration","","","The company aims to provide inclusive and equitable quality education and lifelong learning opportunities.","Ensure inclusive and equitable quality education and promote lifelong learning opportunities for all."
2020,144,"SDG LOCATION(S) PAGE NUMBER",1,"weak","Mention only","SDG 5","aspiration","","","The company strives for gender equality and empowerment of women and girls.","Achieve gender equality and empower all women and girls."
2020,112,"STRATEGIC FOCUS AREAS > S6 Air emissions",1,"weak","Mention only","SDG 3","aspiration","","","The company believes that reducing emissions is important for the health of employees and surrounding communities.","We firmly believe that lesser emissions of regulated pollutants have a significant bearing on the health of our employees and the communities living around our units."
2020,48,"RISK MANAGEMENT",1,"weak","Mention only","SDG 13","aspiration","","","The text states that there is a growing global focus on environmental protection and combating climate change.","Globally, public interest in environmental protection has increased in recent years, with increasing efforts to combat climate change."
2022,19,"2. Details of the scope and coverage of any Human rights due-diligence conducted. We propose to carry out the assessment in the near future. 3.",9,"strong","Measurable","SDG 7, SDG 12","target, measured_outcome","✓","✓","JSW Steel Salem achieved its energy efficiency targets under the PAT scheme, verified by a third party.","JSW Steel Salem- PAT Cycle-III- FY20- Target Achieved as per the 3rd party verification."
2022,13,"b.",9,"strong","Measurable","SDG 8","initiative, target, measured_outcome","✓","","The company underwent British Safety Council audits, with one plant achieving a 5-star rating.","• British safety council Audits were initiated at our plants. Salem unit become the first ISP in the world to be recognised with 5 Star rating."
