"Year","Page","Section","Score","Strength","Stage","SDGs","Tags","Quant","Oversight","Summary","Text"
2024,129,"STATUTORY REPORTS |",3,"moderate","Planned","SDG 15","target","","","JSW Steel aims to achieve 'No Net Loss' of biodiversity by 2030.","JSW Steel pursues the biodiversity conservation for the protection and management of biodiversity to obtain resources for sustainable development, having its target to achieve a “No Net Loss” by 2030."
2024,21,"Charting a greener path, targeting Net Neutral by 2050",3,"moderate","Planned","SDG 13","aspiration, policy","","","The company committed to achieving net neutrality in carbon emissions by 2050.","In January 2024, we announced our commitment to achieving net neutrality in carbon emissions by 2050, significantly ahead of India's Net Zero commitments by 2070, through both short-term and long-term initiatives."
2024,48,"CLIMATE CHANGE",3,"moderate","Planned","SDG 13","aspiration, policy","","","The company states its commitment to a low-carbon future and has taken actions towards this goal.","Anchored in our commitment to forging a low-carbon future, we have embarked on a journey marked by decisive actions and strategic foresight."
2024,48,"CLIMATE CHANGE",3,"moderate","Planned","SDG 13","aspiration, target","","","The company states its ambition to achieve net-zero carbon emissions by 2050.","As the world grapples with the escalating impacts of climate change, sustainability has never been more crucial. At JSW Steel, we are rising to the challenge with an ambitious target: achieving net neutral in carbon emissions for all operations under our direct control by 2050."
2024,129,"STATUTORY REPORTS |",3,"moderate","Mention only","SDG 13","initiative","✓","","The company mentions reducing air and noise pollution and carbon absorption.","the temperature, reducing air and noise pollution, and absorbing up to 30 times more carbon."
2024,129,"STATUTORY REPORTS |",3,"moderate","Planned","SDG 1, SDG 2, SDG 3, SDG 4, SDG 5, SDG 8, SDG 10, SDG 11, SDG 12, SDG 13, SDG 16, SDG 17","initiative","","","The company lists various interventions related to education, healthcare, sanitation, environment, and livelihoods.","The interventions range from strengthening educational institutions to provisioning of secondary and tertiary healthcare and strengthening of public health system, helping communities access basic sanitation and promoting hygiene, contributing towards water and environment conservation, facilitating women-centric livelihoods, and promoting agri-livelihoods approach."
2024,47,"INNOVATING FOR A GREENER TOMORROW At JSW Steel, all our business operations are underpinned by a singular guiding philosophy – minimising environmental footprint and promoting ecological well-being. Recognising the critical importance of nurturing a healthy environment, we have adopted a proactive approach. Through innovation, cutting-edge technologies, operational and cultural",3,"moderate","Mention only","SDG 12, SDG 13","policy, initiative","","","The company outlines key commitments related to environmental responsibility.","Our key commitments include integrating environmental considerations into our business strategies, preventing pollution, evaluating impacts, and fulfilling all related obligations."
2024,47,"INNOVATING FOR A GREENER TOMORROW At JSW Steel, all our business operations are underpinned by a singular guiding philosophy – minimising environmental footprint and promoting ecological well-being. Recognising the critical importance of nurturing a healthy environment, we have adopted a proactive approach. Through innovation, cutting-edge technologies, operational and cultural",3,"moderate","Planned","SDG 13","aspiration, target","","","The company aims to reduce its carbon footprint and promote sustainable practices.","With a focus on clear decarbonisation targets, our aim is to emerge as a recognised advocate for sustainable practices within our industry."
2024,47,"INNOVATING FOR A GREENER TOMORROW At JSW Steel, all our business operations are underpinned by a singular guiding philosophy – minimising environmental footprint and promoting ecological well-being. Recognising the critical importance of nurturing a healthy environment, we have adopted a proactive approach. Through innovation, cutting-edge technologies, operational and cultural",3,"moderate","Mention only","SDG 12, SDG 13, SDG 17","governance","✓","✓","The company has achieved high recognition in sustainability rankings.","We have been included in the DJSI World Index and the DJSI Index for Emerging Markets, with a 99th percentile score in the 2023 S&P Global Corporate Sustainability Assessment."
2024,129,"STATUTORY REPORTS |",3,"moderate","Planned","SDG 12","initiative","","","The company foundation aims to improve waste management systems and promote a circular economy.","JSW Foundation strives to improve existing waste management systems and generate awareness to move towards a circular economy."
2024,129,"STATUTORY REPORTS |",3,"moderate","Planned","SDG 8, SDG 5","initiative","","","The company foundation focuses on skills development for youth and women in rural areas.","JSW Foundation focuses on increasing the employability opportunity through skills development of youth and women in rural areas with innovative solutions."
2024,129,"STATUTORY REPORTS |",3,"moderate","Planned","SDG 2","initiative","","","The company foundation aims to improve agricultural practices and increase farmer income.","The interventions aim to contribute to secure, inclusive and sustainable agricultural practices by working alongside farmers to increase production and income, encouraging methods among farmers through a variety of demonstration farms, trainings, and grassroots capacity development."
2024,129,"STATUTORY REPORTS |",3,"moderate","Planned","SDG 3","initiative","","","The company foundation aims to develop sports infrastructure and support athletes.","JSW Foundation is paving the way for the development of sports by focusing on offering comprehensive and integrated solutions for communities from infrastructure support, to ensuring adequate nutrition and training to coaches, to partnering with government bodies and other organisations for growth."
2024,129,"STATUTORY REPORTS |",3,"moderate","Planned","SDG 7, SDG 11, SDG 12, SDG 13, SDG 14, SDG 15, SDG 8, SDG 5","target","","","The company has set targets for sustainability KPIs related to various environmental and social issues.","JSW Steel has set aggressive targets for Sustainability KPIs related to climate change, energy, water, waste, air emissions, biodiversity, safety, diversity, etc."
2024,22,"TOWARDS A GREENER, STRONGER FUTURE MESSAGE FROM THE JMD AND CEO Dear Stakeholders,",3,"moderate","Planned","SDG 13","target","","","The company has set a target to achieve Net Zero emissions by 2050.","At JSW Steel, our sustainability initiatives are both ambitious and strategic, and during the year, we announced a target of achieving Net Neutral emissions by 2050."
2024,22,"TOWARDS A GREENER, STRONGER FUTURE MESSAGE FROM THE JMD AND CEO Dear Stakeholders,",3,"moderate","Planned","SDG 7, SDG 12, SDG 13","initiative","","","The company plans to achieve its Net Zero target through various initiatives like improving energy efficiency and using renewable energy.","The short-term initiatives to achieve this target will be improving energy efficiency, transitioning towards renewable energy, improving material quality, increasing circularity, improving process efficiencies as well as utilising alternative fuel sources."
2024,129,"STATUTORY REPORTS |",2,"weak","Mention only","SDG 1, SDG 2, SDG 3, SDG 4, SDG 5, SDG 6, SDG 7, SDG 8, SDG 9, SDG 10, SDG 11, SDG 12, SDG 13, SDG 14, SDG 15, SDG 16, SDG 17","policy","","","The company states its sustainability framework aligns with various international standards, including the UNSDGs.","JSW Steel’s sustainability framework is aligned to numerous national and international standards like ISO, IFC, UNGC, OECD, UNSDGs, UNGP-BHR, and the NGRBC."
2024,19,"Advancing our sustainability agenda",2,"weak","Mention only","SDG 13","initiative","","","The company has received recognition for its sustainability efforts through inclusion in indices and awards.","JSW Steel has been included in the DJSI World Index as well as the DJSI Emerging Markets Index, and our flagship decarbonisation program – SEED, has been awarded the Global Energy Transition Changemaker award at COP 28."
2024,19,"Advancing our sustainability agenda",2,"weak","Mention only","SDG 13","initiative","","","The company received a Leadership Rating in Climate Change for four consecutive years.","Additionally, JSW Steel was awarded a Leadership Rating in Climate change for the fourth consecutive year."
2024,10,"Our decarbonisation commitments",2,"weak","Mention only","SDG 13","aspiration, policy","","","The company's decarbonization strategy aligns with the IEA's roadmap and the Paris Agreement's goals to limit global warming.","Our decarbonisation strategy is structured around ambitious long-term targets, announced by the International Energy Agency’s (IEA) Iron and Steel Technology Roadmap (2020). This roadmap supports the Paris Agreement's objectives to limit global temperature rise to below 2°C, ideally to 1.5°C."
2024,48,"CLIMATE CHANGE",2,"weak","Mention only","SDG 13","policy","","","The company outlines its climate change policy with three key pillars: preventing climate change, mitigating and adapting to its impacts, and building resilience.","Our climate change policy is structured around three foundational pillars: ∞Preventing the causes of climate change ∞Mitigating and adapting to its impacts ∞Creating resilience to its ensuing effects"
2024,47,"INNOVATING FOR A GREENER TOMORROW At JSW Steel, all our business operations are underpinned by a singular guiding philosophy – minimising environmental footprint and promoting ecological well-being. Recognising the critical importance of nurturing a healthy environment, we have adopted a proactive approach. Through innovation, cutting-edge technologies, operational and cultural",2,"weak","Mention only","SDG 13","aspiration, policy","","","The company states its commitment to environmental protection through innovation and sustainable practices.","Recognising the critical importance of nurturing a healthy environment, we have adopted a proactive approach. Through innovation, cutting-edge technologies, operational and cultural changes, we mitigate long-term environmental risks while promoting sustainability."
2024,47,"INNOVATING FOR A GREENER TOMORROW At JSW Steel, all our business operations are underpinned by a singular guiding philosophy – minimising environmental footprint and promoting ecological well-being. Recognising the critical importance of nurturing a healthy environment, we have adopted a proactive approach. Through innovation, cutting-edge technologies, operational and cultural",2,"weak","Mention only","SDG 15","initiative","","","The company engages with stakeholders to promote environmental awareness and conservation.","Additionally, we engage with stakeholders to foster environmental awareness and lead conservation efforts in the ecosystems surrounding our operations."
2024,32,"Creating Value RISK MANAGEMENT Cyber security Carbon Border Adjust- ment Mechanism risk Environment protection and climate change Impact",2,"weak","Mention only","SDG 13","policy","","","The company acknowledges the increasing pressure for climate action and potential impact on its operations.","In India, as elsewhere, climate action is intensifying but any drastic change in carbon emission regulations may adversely impact our business and operations."
2024,32,"Creating Value RISK MANAGEMENT Cyber security Carbon Border Adjust- ment Mechanism risk Environment protection and climate change Impact",2,"weak","Mention only","SDG 13","policy","","","The company recognizes the potential financial and operational impacts of complying with stricter environmental regulations.","Compliance with new and more stringent environmental obligations related to greenhouse gas (GHG) emissions may require additional capital expenditure or modifications in operating practices and additional reporting obligations."
2024,12,"OUR INTEGRATED PURPOSE FRAMEWORK Strategic growth with efficient capital allocation",2,"weak","Mention only","SDG 12, SDG 13, SDG 17","aspiration, policy","","","The company states its commitment to integrating sustainable practices into its operations.","Integrating sustainable practices into our core operations to ensure environmental stewardship and social responsibility, shaping a sustainable future for all stakeholders."
2024,129,"STATUTORY REPORTS |",2,"weak","Mention only","SDG 1, SDG 2, SDG 3, SDG 4, SDG 5, SDG 6, SDG 7, SDG 8, SDG 9, SDG 10, SDG 11, SDG 12, SDG 13, SDG 14, SDG 15, SDG 16, SDG 17","policy","","","The company states that its policies are based on NGRBC and various international standards, including the UN Sustainable Development Goals.","The policies are based on NGRBC taking account of the requirements of various international standards like ISO 9000, ISO 14000, ISO45001, ISO 50001, ISO26000, SA8000, IFC Performance Standards, OECD Guidelines, UNGC guidelines and ILO Principles, ILO Convention on Human Rights, Report on Affirmative Action by CII, National Action Plan on Climate Change, National Environmental Policy, UN Sustainable Development Goals, Global Reporting Initiative, Carbon Disclosure Project (CDP), Dow Jones Sustainability Index (DJSI) and Task Force on Climate-related Financial Disclosures (TCFD)."
2024,45,"At JSW, our vision is to actively contribute to society's development in a socially, ethically, and environmentally responsible manner. Our goal is to ensure that our actions support meeting the needs of all, without compromising the ability of future generations to meet their own needs. SUSTAIN Mainstreaming sustainability across the businesses",1,"weak","Mention only","SDG 3, SDG 8, SDG 12, SDG 13","aspiration","","","The company states its vision is to contribute to societal development in a responsible manner, supporting the needs of present and future generations.","At JSW, our vision is to actively contribute to society's development in a socially, ethically, and environmentally responsible manner. Our goal is to ensure that our actions support meeting the needs of all, without compromising the ability of future generations to meet their own needs."
2024,129,"STATUTORY REPORTS |",1,"weak","Mention only","SDG 13","aspiration","","","The company's CO2 reduction target aligns with the global sustainable development scenario.","This target is aligned with the global sustainable development scenario (SDS) pathway."
2024,129,"STATUTORY REPORTS |",1,"weak","Mention only","SDG 1, SDG 2, SDG 3, SDG 4, SDG 5, SDG 8, SDG 10, SDG 11, SDG 12, SDG 13, SDG 16, SDG 17","aspiration","","","The company aims to drive sustainable change among communities across eight cause areas.","The aim is to drive meaningful and sustainable change among communities (Direct Influence Zones and Indirect Influence Zones) across eight cause areas."
2025,170,"B. OPERATIONAL PERFORMANCE",8,"strong","Measurable","SDG 13","target, measured_outcome","✓","","The company has set a target to reduce CO2 emissions by 42% by 2030 and has already achieved a 30% reduction in CO2 emission intensity.","Whilst the Company has set a target to achieve 42% reduction in its CO2 emissions by 2030, it has made significant progress in achieving its commitment towards climate change mitigation by reducing its CO2 emission intensity by 30% from its base year of 2005 in FY 25."
2025,2,"JSW STEEL",8,"strong","Measurable","SDG 8, SDG 12","target, measured_outcome","✓","","The company has achieved ResponsibleSteel™ Certification for over 80% of its primary steel production.","With over 80% of our primary steel now certified, and Tarapur leading as India’s first certified downstream mill, we are setting bold benchmarks for ethical, environmental, and socially responsible steelmaking."
2025,53,"JSW STEEL",8,"strong","In progress","SDG 13","initiative, measured_outcome","✓","✓","The COE executed 565 projects in FY 2024-25, contributing to emissions reductions and improved environmental performance.","In FY 2024–25 alone, the COE executed 565 projects, many of which delivered tangible emissions reductions and helped improve the sustainability and environmental performance of our operations."
2025,12,"JSW STEEL",7,"strong","In progress","SDG 13","initiative, target, kpi","✓","","The company has a program to reduce CO2 emissions by 42% by the end of the decade.","Through our flagship SEED (Sustainable Energy, Environment and Decarbonisation) programme, we have charted a clear pathway for a 42% reduction in our specific CO2 emissions by the end of this decade."
2025,53,"JSW STEEL",7,"strong","In progress","SDG 1, SDG 2, SDG 3, SDG 4, SDG 8, SDG 10","initiative, target, kpi","✓","","The company aims to reach over two million people through community initiatives focused on education, health, nutrition, and skill development.","Improve community reach by touching over two million lives across initiatives across education, heath & nutrition and skill development for livelihood improvement through JSW Foundation."
2025,117,"JSW STEEL",7,"strong","In progress","SDG 13","kpi, measured_outcome","✓","","The company reduced its Scope 1 and 2 emission intensity by 3% and specific energy consumption by 3.5% in the previous fiscal year.","In FY 2024-25, the Company reduced its Scope 1 and 2 emission intensity by ~3% and specific energy consumption by 3.5% from the previous year."
2025,53,"JSW STEEL",7,"strong","Planned","SDG 13","target, initiative, measured_outcome","✓","","The SEED initiative aims to reduce CO2 emissions by 18 million tonnes by 2030.","SEED aims to deliver measurable reductions in CO2 emissions across our value chain, with an ambitious goal of cutting over 18 million tonnes of CO2 by 2030."
2025,53,"JSW STEEL",6,"strong","Planned","SDG 7","initiative, target, kpi","✓","","The company aims to expedite renewable energy projects of approximately 1 GW.","Climate Change Key KRAs included expediting renewable energy projects of ~1 GW;"
2025,117,"JSW STEEL",6,"strong","In progress","SDG 7, SDG 13","initiative, target","✓","","The company expanded its renewable energy capacity to 782 MW and aims to reach 1 GW in the near future.","JSW Steel is also strategically integrating renewable energy into its operations, enhancing resilience against energy market volatility and regulatory changes. This year, the Company expanded its cumulative renewable energy capacity to 782 MW, with the target to reach 1 GW in the near term, further reducing its carbon footprint."
2025,170,"B. OPERATIONAL PERFORMANCE",6,"strong","In progress","SDG 13","target, kpi","✓","","The company has set a target to reduce CO2 emissions by 42% by 2030 and has already reduced its CO2 emission intensity by 30% since 2005.","Whilst the Company has set a target to achieve 42% reduction in its CO2 emissions by 2030, it has made significant progress in achieving its commitment towards climate change mitigation by reducing its CO2 emission intensity by 30% from its base year of 2005 in FY 25."
2025,26,"JSW STEEL",6,"strong","In progress","SDG 12","initiative, policy","✓","","JSW Steel is setting up a 0.5 MTPA scrap processing facility in Maharashtra, aligned with the government's Steel Scrap Recycling Policy.","Aligned with the Government of India’s Steel Scrap Recycling Policy, 2019, we are setting up a 0.5 MTPA scrap processing facility in Maharashtra."
2025,53,"JSW STEEL",6,"strong","In progress","SDG 12, SDG 17","policy, initiative, governance","","✓","The company integrates sustainability into its core business strategy through the SEED initiative and the COE.","By embedding SEED within the COE's structured, data-driven framework, we have ensured that sustainability is not merely a siloed effort but a centrally governed, enterprise-wide priority at the very nucleus of our business strategy and value proposition."
2025,53,"JSW STEEL",5,"moderate","Planned","SDG 6","initiative, target, kpi","","","The company has targets related to water stewardship, including reducing water consumption levels.","Nature action KRAs included targets related to water stewardship, including reduction of specific water consumption levels."
2025,53,"JSW STEEL",5,"moderate","In progress","SDG 9, SDG 13","initiative, target","","","The company is a founding member of EV100+, an initiative to phase out polluting vehicles.","As founding members of EV100+, an initiative dedicated to phasing out heavily-polluting vehicles, we are also actively advancing sustainability across industries."
2025,170,"B. OPERATIONAL PERFORMANCE",5,"moderate","In progress","SDG 13","policy, target","","","The company has a documented climate action plan and report.","The Company’s climate change ambitions, strategy, targets and plans are well documented in the report."
2025,117,"JSW STEEL",5,"moderate","Planned","SDG 7, SDG 13","initiative, target","✓","","The company plans to source an additional 1.5 GW of renewable power in the future.","In the second phase, JSW Steel is planning to source additional renewable power of 1.5 GW."
2025,53,"JSW STEEL",5,"moderate","In progress","SDG 6","kpi","✓","","The company reports a 7.86 lakh cubic meter increase in their water harvesting capacity.","7.86 lakh m3 Increase in our water harvesting capacity"
2025,53,"JSW STEEL",5,"moderate","In progress","SDG 13, SDG 15","initiative","","✓","The company is undertaking tree plantations across all locations in collaboration with forest departments.","Tree plantations are underway across all our locations, supported by long-term Memorandums of Understanding (MoUs) with forest departments."
2025,53,"JSW STEEL",5,"moderate","In progress","SDG 13, SDG 15","kpi","✓","","The company reports planting over 200,000 tree saplings.","200,000+ Tree saplings planted"
2025,53,"JSW STEEL",5,"moderate","In progress","SDG 7, SDG 13","initiative","✓","","The company reports installing over 300 solar streetlamps.","300+ Solar streetlamps installed"
2025,26,"JSW STEEL",5,"moderate","Planned","SDG 13","target, kpi","✓","","JSW Steel aims to reduce emissions intensity by 42% by 2030 through various initiatives.","By 2030, we aim to reduce emissions intensity by 42% from the base year through process efficiency, renewable energy, green hydrogen, carbon capture, material circularity, and breakthrough technologies, among others."
2025,53,"JSW STEEL",5,"moderate","In progress","SDG 13","initiative","","✓","The company maintains a virtual CO2 bank that is monitored by a third-party auditor.","These savings are documented and deposited in a virtual CO2 bank, which is also monitored by third party auditor."
2025,53,"JSW STEEL",5,"moderate","In progress","SDG 7, SDG 9, SDG 12, SDG 13","initiative, target","","","The company's proactive response to climate change is supported by investments in green technologies, renewable energy, and circular economy initiatives.","This proactive response stems from our commitment to future-proofing our business, ensuring policy compliance, and bolstering operational resilience, and it is supported by our investments in green technologies, renewable energy, and circular economy initiatives."
2025,53,"JSW STEEL",5,"moderate","In progress","SDG 6","initiative, policy","","","The company has implemented a Water Stewardship Program across all its operations.","Recognising this, we have deployed a Water Stewardship Program across all our operations."
2025,53,"JSW STEEL",5,"moderate","In progress","SDG 6","initiative, target","","","The Water Stewardship Program focuses on water efficiency, rainwater harvesting, recycling, zero-liquid discharge, and community watershed initiatives.","The program focuses on water efficiency, rainwater harvesting, recycling, zero-liquid discharge (ZLD) and community watershed initiatives."
2025,34,"JSW STEEL",5,"moderate","Planned","SDG 13","target, kpi","✓","","The company targets a 42% decrease in CO2 emission intensity by 2030.","∞42% decrease in CO2 emission intensity to 1.95 tCO2/tcs by 2030."
2025,34,"JSW STEEL",5,"moderate","Planned","SDG 6","target, kpi","✓","","The company targets a 39% decrease in specific water consumption by 2030.","∞39% decrease in specific water consumption to 2.21 m3/tcs by 2030."
2025,34,"JSW STEEL",5,"moderate","In progress","SDG 7, SDG 9, SDG 12, SDG 13","initiative, policy","","","The company is advancing data-driven climate action, environmental stewardship, and circular economy practices.","We are advancing data-driven climate action, environmental stewardship, and circular economy practices, establishing JSW Steel as a leader in decarbonisation and intelligent manufacturing."
2025,34,"JSW STEEL",5,"moderate","In progress","SDG 8, SDG 12","initiative, policy","","","The company has assessed the sustainability practices of its supply chain using a digital monitoring system.","JSW Steel has assessed the sustainability practices of the supply chain through a digitalised monitoring system, proactively identifying operational risks and generating action plans."
2025,34,"JSW STEEL",5,"moderate","In progress","SDG 8, SDG 12","initiative, policy","","","The company's supply chain monitoring system ensures transparency and continuous improvement through a scoring system.","The system enabled monitoring and continuous improvement process guarantees transparency in evaluating the production process of the supply chain, through a intuitive scoring system."
